### ISSUE TITLE
Katana not using system default DNS as resolver

### ISSUE THREAD

**Issue by trib** [projectdiscovery/katana#237]
### katana version:
v0.0.2

### Current Behavior:
When trying to crawl domains not visible on public DNS I noticed none of them is resolving since katana is using 1.1.1.1 and 8.8.8.8 as DNS instead of the system default DNS configured in '/etc/resolv.conf'

### Expected Behavior:
Katana should use the system default DNS or make it configurable.

### Steps To Reproduce:
1. run 'katana -v -u https://internal.only.domain'

2. Get Error:
"[WRN] Could not request seed URL: GET https://internal.only.domain giving up after 2 attempts: Get "https://internal.only.domain": no address found for host"

### Anything else:
2x Tcpdump to confirm wrong DNS is used (while crawling www.google.com) :
While crawling with Katana:
17:24:45.596995 enp3s0 Out IP 10.15.0.50.36548 > <b>1.1.1.1</b>.53: 10423+ [1au] A? [www.google.com] 
17:24:45.623854 enp3s0 In  IP <b>1.1.1.1</b>.53 > 10.15.0.50.36548: 10423 1/0/1 A 142.250.186.68
17:24:45.623965 enp3s0 Out IP 10.15.0.50.52401 > <b>1.1.1.1</b>.53: 10423+ [1au] AAAA? [www.google.com]
17:24:45.651882 enp3s0 In  IP <b>1.1.1.1</b>.53 > 10.15.0.50.52401: 10423 1/0/1 AAAA 2a00:1450:4001:810::2004
17:24:46.597719 enp3s0 Out IP 10.15.0.50.34316 > <b>8.8.8.8</b>.53: 41084+ [1au] A? [store.google.com]
17:24:46.633427 enp3s0 In  IP <b>8.8.8.8</b>.53 > 10.15.0.50.34316: 41084 1/0/1 A 142.250.184.206

Querying via ‘host www.google.com’ command  using configured system default DNS (10.15.0.30): 
17:25:33.934629 enp3s0 Out IP 10.15.0.50.50370 > <b>10.15.0.30</b>.53: 42069+ A? [www.google.com]
17:25:33.950980 enp3s0 In  IP <b>10.15.0.30</b>.53 > 10.15.0.50.50370: 42069 1/0/0 A 172.217.19.68 (48)

**Comment by Mzack9999** [comment]
Depends on https://github.com/projectdiscovery/retryabledns/issues/86 - This will be automatically fixed upon new retryabledns => fastdialer release

**Comment by leveryd** [comment]
> Depends on [projectdiscovery/retryabledns#86](https://github.com/projectdiscovery/retryabledns/issues/86) - This will be automatically fixed upon new retryabledns => fastdialer release

when katana can fix this bug?

I see katana:v0.0.2 `go.mod` import the "bug version" retryabledns.

```
github.com/projectdiscovery/retryabledns v1.0.15
```

Will u upgrade retryabledns version in the `go.mod` to fix bug?

**Comment by leveryd** [comment]
@ehsandeep @Mzack9999  

Do u confirm it has been fixed?

I test using katana:v0.0.3 docker image, i think it has not been fixed in the container image.
